{
  "schemaVersion":"developer-exercise-family.v1",
  "id":"DEV-EF-M02-M05-TESTING",
  "version":"1.0.0",
  "variantPolicy":"Seeded defect signals vary replay context but are not independent published assets or assessment items.",
  "variantDimensions":{
    "failureSignal":["bean-not-found","context-cycle","database-constraint","authorization-regression"],
    "deliveryPressure":["routine-change","release-candidate","production-hotfix"]
  },
  "exercises":[
    {
      "id":"DEV-EX-M02-001","moduleId":"M02","version":"1.0.0","title":"Repair Extension Wiring with a Red-Green Test Pair","type":"test-driven-defect-repair","difficulty":"foundation","estimatedMinutes":35,
      "competencyIds":["C-EXT-002","C-TEST-EXT-001"],"objective":"Diagnose a missing extension/Spring dependency and define separate fast unit and platform context tests before accepting the repair.",
      "initialState":{"defect":"academyfacades declares a bean whose constructor requires academyCoreService, but extensioninfo.xml omits the core extension dependency.","defectiveImplementation":"<requires-extension name=\"commercefacades\"/> <!-- academycore missing -->","observedFailure":"Application context creation reports no qualifying academyCoreService bean."},
      "prompt":"Produce the minimal dependency repair and a red-green test plan. Include a Mockito unit test for facade delegation and a platform context/integration test that proves the actual extension graph and Spring bean load. Explain which test can run without Commerce and which requires the JUnit tenant/runtime. Record the failing signal, command/report artifact, expected negative case, and passing evidence; do not claim live execution.",
      "constraints":["Do not add unrelated global extensions.","Do not call an ordinary Mockito test a platform integration test.","No licensed SAP Commerce runtime is available in this repository."],
      "deliverable":["minimal manifest/configuration change","unit-test outline","platform integration-test outline","red/green evidence record","failure-case explanation"],
      "acceptanceCriteria":["Identifies the missing declared extension dependency.","Isolates facade behavior with a mock in the unit test.","Uses a platform context test for real Spring/extension wiring.","Includes a negative context-load signal and passing rerun evidence.","Labels platform execution as required but unavailable locally.","Names the targeted test command/report without claiming it ran."],
      "hints":[{"level":1,"text":"A Mockito test can prove delegation but cannot prove localextensions/extensioninfo or the platform application context."},{"level":2,"text":"Require one red context-load observation before the manifest repair and one green report after it in a real Commerce test environment."}],
      "evaluation":{"mode":"dual-competency","implementationConceptGroups":[["extensioninfo","dependency","requires"],["bean","spring","context"],["minimal","academycore","repair"],["facade","service","delegation"]],"testingConceptGroups":[["junit","unit","mockito"],["integration","platform","context"],["testsrc","tenant","runtime"],["assert","verify","negative"],["red","green","regression"]],"negativePathGroups":[["missing","failure","red"],["context","bean"]],"executionEvidenceGroups":[["command","target","report"],["result","pass","green"]],"implementationThreshold":0.75,"testingThreshold":0.8,"untestedImplementationScoreCap":0.79,"competencyEvidenceMap":{"implementation":["C-EXT-002"],"testing":["C-TEST-EXT-001"]},"hardFailPhrases":["tested on live sap commerce","skip integration tests"]},
      "referenceSolution":"Add the precise academycore dependency, retain constructor injection, and write a fast Mockito facade test for delegation and failure propagation. Add a platform integration/context test under testsrc that loads the actual bean and asserts its dependency is resolvable. Capture the pre-fix context failure and post-fix targeted test report in a licensed runtime. This academy evaluates the plan and defect diagnosis only.",
      "sourceIds":["SAP-HELP-EXTENSION","RS-SAP-TESTING-JUNIT","RS-SAP-TESTING-JUNIT5","RS-SAP-TESTING-EXECUTION"],"reviewStatus":"implemented-machine-validated","executionBoundary":"The academy executes deterministic rubric validation only; the platform context test requires a configured SAP Commerce JUnit tenant and was not run here."
    },
    {
      "id":"DEV-EX-M03-001","moduleId":"M03","version":"1.0.0","title":"Expose a Broken Relation with Persistence Integration Tests","type":"platform-integration-test-design","difficulty":"application","estimatedMinutes":50,
      "competencyIds":["C-TYPE-002","C-TEST-TYPE-001"],"objective":"Correct a relation cardinality/uniqueness defect and prove persisted behavior, rejection, cleanup, and query semantics in the platform test runtime.",
      "initialState":{"defect":"ComplianceDocument.code is treated as globally unique although business identity is catalogVersion plus code; a relation also permits the same document to be assigned twice.","defectiveImplementation":"<attribute qualifier=\"code\"><modifiers unique=\"true\"/></attribute>","failure":"Importing the same code in Staged and Online violates the generated persistence constraint."},
      "prompt":"Redesign the identity and relation, then specify a transactional platform integration test using version-appropriate SAP Commerce base-test infrastructure. Test Staged/Online coexistence, duplicate rejection within one catalog version, relation uniqueness, FlexibleSearch retrieval, and cleanup/isolation. Separate any pure mapper/unit tests from tests requiring generated models, type metadata, database persistence, and the JUnit tenant. Include red and green result evidence without claiming execution here.",
      "constraints":["Do not solve the defect by removing every uniqueness invariant.","Do not use an in-memory POJO test as proof of Commerce persistence behavior.","Schema/update implications must be explicit."],
      "deliverable":["corrected items.xml design","migration note","transactional integration-test fixture","negative-path assertions","execution evidence checklist"],
      "acceptanceCriteria":["Defines composite business identity semantics.","Tests two catalog versions and same-version duplicates.","Verifies relation uniqueness and FlexibleSearch retrieval.","Uses isolated deterministic data and cleanup/transaction behavior.","Distinguishes generated-model/database tests from pure unit tests.","Records target update line, runner mode, command, report, and unavailable local execution."],
      "hints":[{"level":1,"text":"A Java equals assertion cannot prove generated deployment constraints or catalog-version persistence."},{"level":2,"text":"The negative test should fail for a same-version duplicate while allowing the same code in another catalog version."}],
      "evaluation":{"mode":"dual-competency","implementationConceptGroups":[["catalogversion","code","identity"],["relation","cardinality","unique"],["items","deployment","update"],["flexiblesearch","query","persistence"]],"testingConceptGroups":[["transactional","platform","integration"],["junit","tenant","testsrc"],["fixture","isolation","cleanup"],["duplicate","constraint","negative"],["generated","model","database"],["report","runner","version"]],"negativePathGroups":[["duplicate","reject","constraint"],["staged","online","catalogversion"]],"executionEvidenceGroups":[["command","runner","report"],["red","green","result"]],"implementationThreshold":0.75,"testingThreshold":0.8,"untestedImplementationScoreCap":0.79,"competencyEvidenceMap":{"implementation":["C-TYPE-002"],"testing":["C-TEST-TYPE-001"]},"hardFailPhrases":["tested on live sap commerce","initialize production"]},
      "referenceSolution":"Model identity as catalogVersion plus code at the service/import contract and use relation modifiers that prevent duplicate assignment without erasing legitimate cross-version records. In the target update line, use the verified transactional SAP Commerce integration base, create isolated catalog versions and documents, assert cross-version success and same-version rejection, query persisted state, and verify rollback/cleanup. Run and capture this only in a configured platform test environment.",
      "sourceIds":["SAP-HELP-ITEMS","RS-SAP-HELP-DB-DESIGN","RS-SAP-TESTING-JUNIT5","RS-SAP-TESTING-EXECUTION"],"reviewStatus":"implemented-machine-validated","executionBoundary":"Generated models, type metadata, FlexibleSearch, and persistence require the SAP Commerce JUnit tenant; this repository does not execute those platform tests."
    },
    {
      "id":"DEV-EX-M04-001","moduleId":"M04","version":"1.0.0","title":"Test Transaction Rollback and External Compensation","type":"fault-injection-and-transaction-testing","difficulty":"advanced","estimatedMinutes":55,
      "competencyIds":["C-SERVICE-002","C-TEST-SERVICE-001"],"objective":"Repair a service that performs a remote reservation inside a local transaction and verify rollback, idempotency, retry, and reconciliation behavior.",
      "initialState":{"defect":"placeOrder saves local order state, calls inventory remotely, then throws before commit; an automatic retry can reserve inventory twice.","defectiveImplementation":"transaction { modelService.save(order); inventoryClient.reserve(order.code); validate(order); }","failure":"The database rolls back but the first remote reservation remains."},
      "prompt":"Propose a safe service boundary and a test-first repair. Include fast Mockito unit tests for call ordering and failure propagation, a transactional platform integration test for local rollback, and a fault-injection/contract test for timeout-after-remote-success and duplicate retry. Define an idempotency or reconciliation mechanism, negative cases, deterministic fixtures, and red/green execution artifacts. State which evidence cannot be produced without SAP Commerce and the external test double.",